{
  "id": "calm-geometry-30",
  "title": "Calm Geometry",
  "subtitle": "30 Easy Patterns to Color",
  "type": "coloring-book",
  "trim": "letter",
  "bleed": false,
  "single_sided": true,
  "designs": 30,
  "page_count_interior": 60,
  "paper_color": "white",
  "ink": "black",
  "cover_finish": "matte",
  "list_price_usd": 9.99,
  "audience": "Adults and teens who enjoy relaxing line art",
  "one_liner": "Original geometric pages for calm, screen-free coloring.",
  "description": "Unwind with clean, original geometric coloring pages. Printed single-sided so markers and gel pens will not bleed onto the next design.",
  "bullets": [
    "30 original black-line designs",
    "Single-sided pages for markers",
    "letter trim, KDP paperback ready",
    "Matte cover recommended",
    "No characters or trademarks \u2014 original patterns only"
  ],
  "keywords": [
    "coloring book",
    "adult coloring",
    "geometric patterns",
    "relaxing",
    "mandala",
    "stress relief",
    "gift"
  ],
  "categories": [
    "Arts & Photography > Drawing > Coloring Books",
    "Self-Help > Stress Management"
  ],
  "ai_assisted": false,
  "status": "draft"
}
